{
  "$schema": "./schemas/app-config.schema.json",
  "name": "Submission PDF Scanner",
  "nameJa": "提出PDFスキャナー",
  "slug": "document-scanner",
  "version": "1.0.4",
  "description": "Scan paper documents, correct perspective, organize pages, and create submission-ready PDFs entirely in your browser.",
  "descriptionJa": "紙を撮影し、台形補正・ページ整理・提出条件に合わせたPDF化までブラウザーだけで完結します。",
  "defaultLanguage": "auto",
  "repository": {
    "owner": "ttomohisa",
    "name": "htmlapps-document-scanner"
  },
  "build": {
    "output": "dist/index.html",
    "blockRuntimeNetwork": true,
    "selfExtract": {
      "enabled": true,
      "output": "dist/index.self-extract.html"
    }
  }
}
